{
  "_id": "project-metadata-id",
  "title": "Project Metadata",
  "slug": "project-metadata",
  "shortDescription": "# Projects Metadata Directory  This directory contains individual JSON files for each portfolio project.  ## Naming Conventions & Rules  1. **Filename...",
  "description": "# Projects Metadata Directory  This directory contains individual JSON files for each portfolio project.  ## Naming Conventions & Rules  1. **Filename Format**: `<project-slug>.json`    - Example: `sold-com.json`, `noteforge-ai.json`, `portfolio-cms-admin.json`    - Must match the `slug` property inside the file.    - Must be lowercase kebab-case.  2. **Ignored Files**:    - Files starting with an underscore `_` (such as `_example-project.json`) are templates or draft examples and will be **igno",
  "category": "Practice",
  "isFeatured": false,
  "status": "Completed",
  "role": "Sole Developer",
  "clientOrCompany": null,
  "duration": null,
  "targetAudience": null,
  "techStackBreakdown": {
    "frontend": [],
    "backend": [],
    "database": [],
    "aiMl": [],
    "infrastructure": [],
    "devops": [],
    "testing": [],
    "tools": [],
    "other": []
  },
  "myContributions": [
    "Developed and configured repository project-metadata"
  ],
  "image": null,
  "gallery": [],
  "architectureDiagram": null,
  "liveUrl": null,
  "githubUrl": "https://github.com/Sameer-Bagul/project-metadata",
  "apiDocsUrl": null,
  "figmaUrl": null,
  "videoUrl": null,
  "contributors": [
    "Sameer-Bagul"
  ],
  "features": [
    "Core project-metadata functionality"
  ],
  "challenges": [],
  "learnings": [],
  "metrics": null,
  "clientTestimonial": null,
  "relatedBlogs": [],
  "futureRoadmap": [],
  "repository": {
    "owner": "Sameer-Bagul",
    "name": "project-metadata",
    "url": "https://github.com/Sameer-Bagul/project-metadata",
    "visibility": "public",
    "fork": false
  },
  "classification": {
    "type": "secondary",
    "portfolioWorthiness": "medium"
  },
  "metadata": {
    "generatedAt": "2026-09-13T12:37:54.459Z",
    "lastAnalyzedAt": "2026-09-13T12:37:54.459Z",
    "sourceCommit": null,
    "manuallyVerified": false
  }
}